1277547548992987_2329854427095622,"**Dear Freshers of AUST,this post is specifically for you kids!  We have been getting a lot of texts,calls regarding AUST IDC membership in the past few days. The wait is over now.   1. What is AUST IDC? - AUST IDC is an open platform for all the students where students from any department can share their ideas and creativity and work on them to make it into reality! One and only tech/Biz club in AUST with more than 2000 members.  2.What are the past activities of aust idc? -The past activities of AUST IDC are : 👉workshop on Graphics Designing(Illustrator and photoshop), LFR, Basic python, Solid Works, Full stack web development & freelancing, Line follower, quadcopter building. 👉Seminar on Entrepreneurship, Robotics and Artificial Intelligence, Skills for the Innovator's Mindset, Higher studies in USA: AUSTian's Journey, Career on IOT by Datasoft. 👉Two intra university Competitions named called Poster Maestros and Innoventure and two national events named Engenius and MINDSPARKS 19 in association with IIT, Roorkee, India  **All of these in just last 4 semesters!!!Whoa!Pretty damn active right?  B|  3.What is the Idc team focusing on right now? - Right now, AUST IDC team is focusing on a intra university tech event called INNOVENTURE 19 , where the segments will be unleashed that never happened before in AUST. 4.What awaits for the freshers this semester and beyond? - Our present members are getting some benefits such as, 👉chance to volunteer the different events  👉get certificates based on their works 👉it helps to develop their communication skills  👉helps to become a corporate one! 👉Find extracurricular opportunities 👉 Attend workshops and seminars on things they want to learn for free! ***And an awesome ID card. ****HOW TO BECOME AN AUSTIDC MEMBER? ***** An IDC booth will be set up in the plaza from 14th july, Sunday and will continue for 3 days where any student of aust looking to being an IDC member to join the cool community,will have to pay a registration fee of 100 taka to earn life time membership!!  So if you want to be a member, look for a  pvc poster in the plaza with a booth! Fill up the form given and be a part of the cool community. 😎😎😎 #AUSTIDC #WHEREMINDSCOLLIDE",Photo,2019-07-12 08:14:04,6769,11994,681,522,701,0,5587,2395,400,0,0,0,0,0,0
1277547548992987_2975912132489845,"RAMADAN MUBARAK, people 😁 May Allah grant our supplications and forgive us for all our sins. May He keep us healthy and stable in these hard times. Let us all pray Tarawih prayers inside and spend this Ramadan with complete patience and Ibadat in our homes.  #RamadanMubarak #StayHome #StaySafe",Photo,2020-04-25 05:48:57,2851,3797,246,90,105,0,2775,2138,193,0,0,0,0,0,0
1277547548992987_2974182369329488,"An hour-long online session named, ""Communication Skills Development 1.0""  was organized by AUST Innovation and Design Club. The session was held on ZOOM on April 23, 2020. It commenced at 7 PM with 30 participants.   Our heartfelt gratitude towards Tanzina Tarique, Manager-Corporate Affairs and CSV at Nestle, for conducting such a zestful and engaging session.  “With better communication skills, you’ll be able to make your stories more interesting. The more interesting it is, the more people will be willing to listen” is exactly what our speaker described. Not only did she share some insightful tips about communication but also shared how she ameliorated her own communication skills by giving examples from her own experience. At the last phase, there was a question and answer session for 20 minutes.",Photo,2020-04-24 10:54:16,2792,3591,264,225,313,1,2183,1670,212,0,0,0,0,0,0
1277547548992987_2946053702142355,"""Winners of different segment of MINDSPARKS 20""  🇧🇩 #MindSparks #Cognizance 🇮🇳 #MindSparks2020 #Cognizance2020 #IdeationIntoExistence  #EccentricityOfExcellence #AUST_IDC",Photo,2020-04-12 08:53:17,1326,1662,280,247,360,0,1585,1269,258,0,0,0,0,0,0
1277547548992987_2930593473688378,"Greetings, QUARANTINED beings! We know you are getting super bored by being home-bound. But for the sake of ourselves and the whole community, we need to keep our mental state strong and fight this crucial time by staying indoors.  This is a great opportunity for all of us to boost up our skills and make our lazy days a bit productive. AUST IDC brings you an ONLINE SERIES to enhance your communication skills. We will try to cover up the following:  1. How to face interviews 2. How to write a CV or Job Letter 3. Career orientation  Each session will be carried out by people working in the HR sector of different reputable companies.   Stay tuned for further updates on our series.  #StayHome #StaySafe",Status,2020-04-05 08:25:34,7162,10714,849,756,887,1,4181,2335,518,0,0,0,0,0,0
1277547548992987_2908771589203900,AUST Innovation and Design Club updated their status.,Status,2020-03-26 09:06:43,540,736,18,13,16,0,661,478,17,0,0,0,0,0,0
1277547548992987_2908597592554633,"AUST Innovation and Design Club organized for the second time, MindSparks, an inter university and college tech-biz competition, which has been one of the biggest competitions of the country. MindSparks 20 was held on the 14th and 15th of March, 2020.   The event has collaborated with Indian Institute of Technology, Roorkee, India as the previous year.   The segments of this year were: MATLAB challenge, Engineering Olympiad, Techno CAD, Truss challenge, Innovation challenge, Soccer Bot, Quad Racing, Poster Presentation and Hardware Project Showcasing. Among which the winners of Techno CAD, Quad Racing, Poster Presentation and Hardware Project Showcasing will get a chance to directly take part in Cognizance of IIT, Roorkee.   There was an additional fun segment, the Pi segment, to celebrate “Pi Day” which was on 14th March.  The program was inaugurated on the first morning by Prof. Dr. Bobby Barua, President of AUST IDC, through the flight of a drone. There were about 1200 students from 34 different universities and colleges, surpassing last year. The prize money was 280,000 Taka.  The two-day event passed with much zeal and enthusiasm of the participants, guests and visitors. MindSparks 20 ended with the closing ceremony held on the evening of 15th March, leaving many memories and a promise to come back next year.  Appreciations to our title sponsor CST, cosponsor Globe and Banglamark, food partner GoGreen, ice cream partner Igloo, photography partner Bridal Snap, news and media partner Bonik Barta and Shomokal, radio partner Jago FM and City FM, digital partner Toggle (the Daily Star), drone partner Rotor Solution, electronics partner Green Electronics and outreach partner Youth Opportunities.",Photo,2020-03-26 07:54:10,3578,5315,872,822,1180,0,3166,1828,556,0,0,0,0,0,0
1277547548992987_2901009369980122,MindSparks 20 has been featured in the Daily Bonik Barta ❤️,Link,2020-03-22 23:48:54,1091,1268,310,73,88,0,1187,1024,180,0,0,0,0,0,0
1277547548992987_2899568456790880,"Hello to all the members of AUST IDC. Hope everybody is doing fine. Everybody is aware of the current COVID situation and the effects are doing to the different parts of the world. Among the founding members and first committee panel of AUST IDC 4 of them are currently pursuing Masters in Germany and 1 is pursuing a Masters in Australia. They are actively seeing the devastation and the dangers of this COVID virus. In those first world countries, the rates of affected people are increasing at an exponential rate. They are all following the rules of home quarantine and staying most of the time in a single room. And they all urge to all of 7943 members to try your best to stay at home without urgent works. Wash your hands with soap if there's a lack of sanitizer, try to avoid things that might make you catch a cold, drink warm waters/drinks, if you are going out using public transport you can wear one time gloves while in the transport. Don't go for fun as the educational institute is closed and you are bored. The students living abroad are staying in their room alone for the last 2 weeks if you feel bored and want to go out please consider them that they are living alone without any family members. In this quarantine time period, we hope you spend time with your family members and loved ones. We all hope if you follow simple rules the rate can be lowered. If you think you are young and the risks are low for you still we will ask you to look who is in your home. Think while you have the time. May Allah help us all and keep you and your family safe. #stay_safe",Status,2020-03-22 08:15:04,1915,2508,166,131,153,0,2014,1480,144,0,0,0,0,0,0
1277547548992987_2887568484657544,***The winner of Pi Game*** ***Ashik Rahman*** ***147 digit in 1 miniute ***,Photo,2020-03-17 01:47:43,2132,2318,321,242,331,0,1918,1784,270,0,0,0,0,0,0
1277547548992987_2881534358594290,"• Grand Finale: March 15, 2020 at VC Seminar Room • Reporting Time: 9.00 AM sharp! • Prize Giving Ceremony will start by 3.00 PM tomorrow at Prof. M. H. Khan Auditorium, AUST.",Photo,2020-03-14 07:29:12,542,610,33,32,35,0,532,473,31,0,0,0,0,0,0
1277547548992987_2879750285439364,"পুরো ক্যাম্পাস সেজেছে পাই নাম্বারে,ছবি তুলতে হলেও একবার আসতে হবে কিন্তু এই প্রাণের ক্যাম্পাসে❤️"" #MINDSPARKS20 loading......",Photo,2020-03-13 10:48:16,9458,10602,1023,608,793,0,4259,3684,697,0,0,0,0,0,0
1277547548992987_2878760498871676,"""Pi Game is Open for All students and Teachers""",Status,2020-03-13 00:06:03,2096,2328,151,97,109,1,1558,1422,131,0,0,0,0,0,0
1277547548992987_2877341525680240,"This is an utmost pleasure for us to announce Youth Opportunities as our ""Official Outreach Partner"" of MindSparks 2020.",Photo,2020-03-12 08:02:50,593,650,19,17,22,0,553,512,19,0,0,0,0,0,0
1277547548992987_2874890942591965,"Meet the organizers of MindSparks 2020, who are working diligently all day and night to arrange a wholesome event! ⚡  #MindSparks20 #AUSTIDC #IdeationIntoExistence",Status,2020-03-11 04:46:45,988,1012,197,190,372,0,936,923,191,0,0,0,0,0,0
1277547548992987_2873357949411931,"""পাই (π) এর মান 3.14 বলে প্রতি বছর মার্চের ১৪ তারিখ পাই দিবস উদযাপন করা হয়। AUST IDC এর উদ্যোগে এমনই এক আকর্ষণীয় সেগমেন্ট থাকছে MINDSPARKS20 এর এবারের আয়োজনে।  পাই গেমের খেলা হবে ক্যাম্পাসে, দশমিকের পরে কত ঘর লিখতে পারো,দেখিয়ে দাও তোমার দক্ষতা। সময় থাকবে মাত্র ১ মিনিট। ১মিনিটে তুমি কয়টা লিখছো পাই এর ডিজিট?"" *** রেজিস্টেশন হবে অন স্পট***",Video,2020-03-10 10:14:26,8595,11147,1051,955,1202,0,3716,2467,509,363,382,2715,3438,8740,67546
1277547548992987_2872790429468683,AUST Innovation and Design Club,SharedVideo,2020-03-10 04:57:06,806,868,70,66,99,0,792,753,67,0,0,175,183,0,1358464
1277547548992987_2871341819613544,"রহস্যে ঘেরা পাই!  পাই একটি ধ্রুবক সংখ্যা, বৃত্তের পরিধিকে এর ব্যাস দিয়ে ভাগ করলে পাই এর মান পাওয়া যায়। এর মান ৩.১৪১৬ । পাই একটি মূলদ সংখ্যা হওয়ায় এর মান দশমিকের পর কখনো শেষ হয় না। এতটুকু তথ্য আমরা হয়তো সকলেই জানি।  কিন্তু কিছু লোক আছে যারা এতটুকুতে ক্ষান্ত নয়, তারা (π) এর মান মুখস্ত বলাকে বিশ্ব রেকর্ডের পর্যায়ে নিয়ে গেছে। এর মধ্যে স্বীকৃত পাইয়ের মান বলার রেকর্ড হলো দশমিক এর পর ৬৭,৮৯০ ঘর, যার অধিকারী চীনের ২৪ বছর বয়স্ক স্নাতক ছাত্র লু চাও।  বাংলাদেশেও এর ব্যতিক্রম নয়, আমাদের সকলের কাছে ""অংক ভাইয়া"" নামে পরিচিত বুয়েটের চমক ভাইও পাই এর মান দশমিক এর পর প্রায় ৫০০ ঘরের মতো বলতে পারে।  এমনকি পাই (π) এর মান 3.14 বলে প্রতি বছর মার্চের ১৪ তারিখ পাই দিবস উদযাপন করা হয়।  AUST IDC এর উদ্যোগে এমনই এক আকর্ষণীয় সেগমেন্ট থাকছে MINDSPARKS20 এর এবারের আয়োজনে।  ""পাই গেমের খেলা হবে ক্যাম্পাসে, দশমিকের পরে কত ঘর লিখতে পারো,দেখিয়ে দাও তোমার দক্ষতা। সময় থাকবে মাত্র ১ মিনিট। ১মিনিটে তুমি কয়টা লিখছো পাই এর ডিজিট?"" *** রেজিস্টেশন হবে অন স্পট***",Photo,2020-03-09 11:08:53,6893,7879,716,650,831,0,2943,2376,404,0,0,0,0,0,0
1277547548992987_2870977579649968,Hear about MindSparks 20: An Inter University and College Tech Competition on City FM 90.6 !! ⚡,SharedVideo,2020-03-09 07:49:31,964,996,139,129,159,0,953,926,136,0,0,213,228,0,1806507
1277547548992987_2870712939676432,"**MindSparks 2020: Innovation Challenge**  Congratulations to the selected TOP 30 teams! Team leaders have been emailed already with detailed proceedings.   Please, check and confirm  your slot by 11.59 PM, 10 March, 2020.  Hurry up!!",Status,2020-03-09 05:18:48,450,482,10,8,8,0,429,402,10,0,0,0,0,0,0
1277547548992987_2869216413159418,***Hurry Up*** ***Only two days Left for Registration in MindSparks***,Photo,2020-03-08 11:25:42,508,548,13,11,12,1,492,459,13,0,0,0,0,0,0
1277547548992987_2869045896509803,This ladies are pride of AUST IDC. They are leading their team and their contribution to idc is remarkable.    #Happy_Womens_day  Yes we are celebrating late. Because this ladies are working hard for MINDSPARKS 20. ❤❤,Photo,2020-03-08 09:55:20,2411,2524,301,174,251,1,2190,2104,279,0,0,0,0,0,0
1277547548992987_2868647959882930,It takes few minutes to complete your registration! Why lagging to be late?   Do it now: http://mindspark20.aamarpay.com,Photo,2020-03-08 06:22:07,415,443,18,16,19,0,396,369,16,0,0,0,0,0,0
1277547548992987_2868267056587687,"Top 30 teams have to confirm their slots by paying registration fee within 11.59 PM, 10 March, 2020. Remember, the timeline will NOT be extended further.  If you miss this deadline to pay your reg fee, then your team will be disqualified.  **Reg. Link: http://mindspark20.aamarpay.com  **WAITING Teams MUST NOT PAY, unless we ask their team leaders to do so. It is suggested that the team leaders remain available over phone calls and emails.  **MOST IMPORTANTLY, stay updated on this event page! Each and every update will be posted here.",Photo,2020-03-08 01:08:33,596,635,65,64,83,0,585,548,63,0,0,0,0,0,0
1277547548992987_2866826060065120,"Evolution 360 Presents "" Idea Innovation Contest"" powered By Interactive Cares, in affiliation with AUST Design & Innovation Club cordially invites all students of AUST   to attend the Idea Innovation Contest.  Please stay tuned to our event page to know more about the competition's details. Registration Deadline is 15 March. Registration Link : http://bit.ly/IdeaGenerationContest2020",Photo,2020-03-07 08:15:14,870,920,54,44,63,0,806,762,49,0,0,0,0,0,0
1277547548992987_2864823890265337,"We, ""AUST Innovation and Design Club"" are proud to announce our club partner from KU (ECE discipline) - ""ROUTER"".  Teams affiliated with our partner clubs will receive a 10% discount on the registration fee. affiliated Teams are encouraged to contact club members for the reference code discount.  -------- • Event Date: 14th (Saturday) & 15th (Sunday) March, 2020. • Reg. Deadline (Innovation Challenge): March 5, 2020 • Reg. Deadline (All Other Segments): March 10, 2020  • Rulebooks of all segments: https://drive.google.com/…/1g1cE-7S8i8cvCW2Oftnvj97Cgh1EA_JH  • Registration link for participants of Innovation Challenge ONLY: https://forms.gle/JMP7pQBo4qX9a5gL6  • Registration link for ALL OTHER SEGMENTS: http://mindspark20.aamarpay.com Image may contain: one or more people and indoor",Photo,2020-03-06 09:11:21,559,587,19,16,21,0,501,478,19,0,0,0,0,0,0
1277547548992987_2864610686953324,Updated Schedule of MindSparks 2020!,Photo,2020-03-06 07:20:11,285,299,10,10,14,0,262,250,10,0,0,0,0,0,0
1277547548992987_2864051130342613,"We regret for the inconvenience to the registered participants who can not participate in accordance to the updated program schedule.  You're requested to CLAIM YOUR REFUND within 11.59 PM, 12 March, 2020.  • Refund Application Link: https://forms.gle/gf1zEsZHuBpK8U829",Photo,2020-03-06 01:48:38,455,479,30,29,39,0,441,418,30,0,0,0,0,0,0
1277547548992987_2864039547010438,"We, ""AUST Innovation and Design Club"" are proud to announce our club partner from MIST - ""MIST Robotics Club"".  Teams registering through the reference of our partner clubs will receive a 10% discount on the registration fee. Teams affiliated with our partner clubs are encouraged to contact club members for the reference code discount.  -------- • Event Date: 14th (Saturday) & 15th (Sunday) March, 2020. • Reg. Deadline (Innovation Challenge): March 5, 2020 • Reg. Deadline (All Other Segments): March 10, 2020  • Rulebooks of all segments: https://drive.google.com/drive/mobile/folders/1g1cE-7S8i8cvCW2Oftnvj97Cgh1EA_JH?usp=drive_open  • Registration link for participants of Innovation Challenge ONLY: https://forms.gle/JMP7pQBo4qX9a5gL6  • Registration link for ALL OTHER SEGMENTS: http://mindspark20.aamarpay.com",Photo,2020-03-06 01:40:38,849,884,33,25,36,0,658,621,32,0,0,0,0,0,0
1277547548992987_2863990950348631,"We, ""AUST Innovation and Design Club"" are proud to announce our club partner from SEC - ""SEC Robotics Club"".  Teams registering through the reference of our partner clubs will receive a 10% discount on the registration fee. Teams affiliated with our partner clubs are encouraged to contact club members for the reference code discount.  -------- • Event Date: 14th (Saturday) & 15th (Sunday) March, 2020. • Reg. Deadline (Innovation Challenge): March 5, 2020 • Reg. Deadline (All Other Segments): March 10, 2020  • Rulebooks of all segments: https://drive.google.com/…/1g1cE-7S8i8cvCW2Oftnvj97Cgh1EA_J…  • Registration link for participants of Innovation Challenge ONLY: https://forms.gle/JMP7pQBo4qX9a5gL6  • Registration link for ALL OTHER SEGMENTS: http://mindspark20.aamarpay.com",Photo,2020-03-06 01:03:26,530,554,21,13,18,0,516,485,20,0,0,0,0,0,0
1277547548992987_2863097777104615,Abstract submission portal for Innovation Challenge has been closed!,Status,2020-03-05 13:29:05,400,418,24,23,26,0,378,357,24,0,0,0,0,0,0
1277547548992987_2862950433786016,Where are the mighty tech giants of AUST!! Look who's here for you guys 😀  Registration is open till 11th MARCH. Don't miss the chance to be a part of it   #mindsparks_20 #austidc,SharedVideo,2020-03-05 11:51:42,733,775,76,66,81,0,731,686,75,0,0,117,123,0,88351
1277547548992987_2862171910530535,"Abstract submission portal for Innovation Challenge will be closed permanently tonight at 11.59 PM.   • Reg. Link for Innovation Challenge:  https://forms.gle/JMP7pQBo4qX9a5gL6  – – –   Reg. Deadline for other segments: 10 March, 2020  • Reg. Link for ALL OTHER SEGMENTS: http://mindspark20.aamarpay.com",Photo,2020-03-05 04:25:01,404,420,21,19,24,0,378,365,19,0,0,0,0,0,0
1277547548992987_2838958546185205,Hello tech lovers of AUST campus. Registration booth will be opened tomorrow for MINDSPARKS 20. Offline Registration will be closed on 27th February,Photo,2020-02-23 07:29:05,5278,5972,157,122,215,0,1627,1314,82,0,0,0,0,0,0
1277547548992987_2838957392851987,Hello tech lovers of AUST campus. Registration booth will be opened tomorrow for MINDSPARKS 20. Offline Registration will be closed on 27th February .,Photo,2020-02-23 07:28:20,591,641,10,6,7,0,578,533,10,0,0,0,0,0,0
1277547548992987_2838699086211151,Last few days...hurry up...grab your seat and show the talents and skills inside you.  Best of luck guys,Link,2020-02-23 05:04:45,544,586,15,13,13,0,528,489,15,0,0,0,0,0,0
1277547548992987_2833752100039183,"আইডিসির  সদস্যদের পক্ষ থেকে সকল ভাষাশহীদ দের প্রতি বিনম্র শ্রদ্ধা কৃতজ্ঞতা জ্ঞাপন করছি। যাদের ত্যাগের কারনে আজ নিজ মায়ের ভাষায় ভাব প্রকাশের স্বাধীনতা পেয়েছি, তাদের এই ঋন মাতৃভাষার মর্যাদা রক্ষা করে পরিশোধ করা উচিত। উনাদের ত্যাগ আমরা বৃথা যেতে দিতে পারি না।",Photo,2020-02-20 22:18:27,2501,2656,159,64,72,0,2048,1912,130,0,0,0,0,0,0
1277547548992987_2828202600594133,"Do not be disheartened, AUSTians. You can still be a part of AUSTIDC even though the booth is closed.  Your immense response has thrilled us, and so we have decided to start the ONLINE REGISTRATION procedure for general member recruitment.  The only thing you got to do, is to follow the steps given in the form, and voila! Be a member of the most awesome club of AUST now.  #AUSTIDC #JoinAUSTIDC #WhereMindsCollide  https://docs.google.com/forms/d/e/1FAIpQLSe_x5PwjGE0lXAW9kjA9bjWwuAnHRsxOOCIBv36ntQ7J4BRrQ/viewform?usp=pp_url",Photo,2020-02-18 09:12:07,2441,2623,170,132,209,0,1663,1489,143,0,0,0,0,0,0
1277547548992987_2812401002174293,"The recruitment of general members of Fall '19 will start from tomorrow.   Our booth will be at the Plaza on the 12th,16th and 17th of February, 2020 from 9:30 AM to 4:20 PM.   Bring a passport size photo of yours and only Tk. 100 and you can easily join the most amazing club of AUST.",Photo,2020-02-11 08:47:07,5554,7123,403,341,408,0,2903,1956,230,0,0,0,0,0,0
1277547548992987_2801539113260482,Submission date extended till 15th February  Hurry up guys..,Photo,2020-02-06 07:22:02,1440,1652,103,82,117,0,1305,1134,88,0,0,0,0,0,0
1277547548992987_2764897530257974,"MINDSPARKS '20, organized by AUST Innovation and Design Club in association with IIT, Roorkee, India, is coming back with more new and exciting segments for you all.  Stay tuned for more updates!  #AUSTIDC #MindSparks20 #IdeationIntoExistence",Video,2020-01-19 07:52:11,12948,18068,1031,872,1321,0,6282,3131,576,1159,1438,3289,5109,4381,15189
1277547548992987_2756391064441954,"Hold on to your seats, tech enthusiasts! We are about to unveil the greatest and the biggest tech competition in Bangladesh.  *Drum rolls*  MINDSPARKS '20!!!  Presented to you by AUST Innovation and Design Club in association with Cognizance 2020, IIT, Roorkee, India. Be ready to take part in the diverse segments of this grand event.",Photo,2020-01-15 07:39:06,7366,8992,661,550,764,0,3345,2434,386,0,0,0,0,0,0
1277547548992987_2689411924473202,মহান বিজয় দিবস আজ,Photo,2019-12-15 20:10:59,3648,4196,275,187,225,0,2899,2507,218,0,0,0,0,0,0
1277547548992987_3400306690050385,"Hello Ahsanullah University of Science & Technology (AUST)! Ennovators 4.0 is coming to our University! To attend the Webinar Session, Join the link https://zoom.us/j/99951499493 on 27th September at 7:30 pm. If you haven’t registered for Ennovators yet, get your journey started by registering at - https://www.banglalink.net/en/e-career/programs/ennovators  Join the webinar session to know more! AUST Innovation and Design Club is the club partner from AUST for this session. Follow us to get all updates - Facebook: Banglalink Careers LinkedIn: https://lnkd.in/ggqMZ4C Instagram: instagram.com/banglalink.careers #ennovators #rethink #restart #recreate",Photo,2020-09-24 08:10:27,900,1034,48,41,57,0,892,766,47,0,0,0,0,0,0
1277547548992987_3368814593199595,"Very recently, AUST IDC has come to a common ground of understanding with SkillHub. We are really delighted!   We will reveal the perks for AUST students soon! 😁",Photo,2020-09-14 09:17:43,829,1017,42,27,32,0,848,687,40,0,0,0,0,0,0
1277547548992987_3368646486549739,"The Result: Nin presents ""Spill the Ink""!!  ------------------------------ • Segment: Research Writing ------------------------------  • Winner: Mahdi Hasan | Ahsanullah University of Science & Technology • Runner-Up: Mehedi Hasan Tusar | IBA, Jahangirnagar University  Congratulations!! 😁✨  ------------------------------ The Winners of ""Non-Fiction"" and the ""Promising Writer"" will be announced later. Stay tuned with patience! 😃",Photo,2020-09-14 08:12:19,2288,2841,216,164,274,0,1185,928,86,0,0,0,0,0,0
